{
  "schema_version": 2,
  "status": "ACTIVE",
  "project_id": "padataset",
  "repository": "adamtrott78/PADataset",
  "repository_visibility": "public",
  "derived_identity": {
    "runner_user": "ci-padataset",
    "runner_group": "ci-padataset",
    "project_root": "/srv/workspace-ci/padataset",
    "lanes": {
      "cpu": {
        "scale_set_name": "lambda-padataset",
        "runner_prefix": "lambda-padataset-"
      },
      "gpu": {
        "scale_set_name": "lambda-padataset-gpu",
        "runner_prefix": "lambda-padataset-gpu-"
      }
    }
  },
  "roots": {
    "jobs": "/srv/workspace-ci/padataset/jobs",
    "staging_cache": "/srv/workspace-ci/padataset/staging-cache",
    "trusted_cache": "/srv/workspace-ci/padataset/trusted-cache",
    "logs": "/srv/workspace-ci/padataset/logs",
    "home": "/srv/workspace-ci/padataset/home"
  },
  "forbidden_paths": [
    "/home/atrott",
    "/var/run/docker.sock",
    "/run/docker.sock",
    "/srv/workspace-ci/research-engine",
    "/var/lib/workspace-ci/provisioner",
    "/run/workspace-ci"
  ],
  "concurrency": 1,
  "routes": {
    "cpu-ci": {
      "activation_state": "ACTIVE",
      "lane": "cpu",
      "execution_contract_id": "cpu-public-ci-v1",
      "trusted_workflow": {
        "path": ".github/workflows/lambda-ci-cpu.yml",
        "default_branch": "main",
        "blob_sha": "5e6a1d4a47ecdfa8b40d3bea23fa8739cc12cd9e"
      },
      "trigger": {
        "event_name": "issue_comment",
        "command": "/lambda-ci-cpu",
        "claim_version": "wc-admission-v1",
        "allowed_actor_logins": [
          "adamtrott78"
        ],
        "require_open_same_repository_pr_head": true,
        "fork_pr_execution_allowed": false
      },
      "bindings": {
        "model_id": null,
        "runtime_id": null
      }
    },
    "gpu-ci": {
      "activation_state": "ACTIVE",
      "lane": "gpu",
      "execution_contract_id": "gpu-single-public-ci-v1",
      "trusted_workflow": {
        "path": ".github/workflows/lambda-ci-gpu.yml",
        "default_branch": "main",
        "blob_sha": "3e0c79dc1b8bed7b1480cc745c478c190a3c7da4"
      },
      "trigger": {
        "event_name": "issue_comment",
        "command": "/lambda-ci-gpu",
        "claim_version": "wc-admission-v1",
        "allowed_actor_logins": [
          "adamtrott78"
        ],
        "require_open_same_repository_pr_head": true,
        "fork_pr_execution_allowed": false
      },
      "bindings": {
        "model_id": null,
        "runtime_id": null
      }
    }
  },
  "bindings": {
    "models": {},
    "runtimes": {}
  },
  "isolation": {
    "unique_project_uid_required": true,
    "sibling_project_roots_inaccessible": true,
    "control_plane_state_inaccessible": true,
    "global_trusted_object_store_inaccessible_by_default": true,
    "only_exact_authorized_trusted_objects_may_be_mounted_readonly": true
  }
}
